{
  "id": "hito-12-sales",
  "hito": 12,
  "title": "Ventas, reversión y PDF",
  "kind": "maobits-pos-module",
  "version": "1.0.0",
  "dependencies": [
    "checkout",
    "cash"
  ],
  "concepts": [
    "history",
    "filters",
    "void",
    "receipt PDF"
  ],
  "sourcePaths": [
    "src/modules/sales",
    "src/core/pdf",
    "app/sales.tsx",
    "app/sale/[id].tsx"
  ],
  "assembly": {
    "inputContracts": [
      "Session/User when required",
      "Repository/Service contracts from dependencies"
    ],
    "outputContracts": [
      "sales service/API",
      "Persisted state where applicable"
    ],
    "rule": "The module may be taught independently, then assembled only through declared contracts."
  },
  "slides": [
    {
      "order": 1,
      "type": "need",
      "title": "Necesidad / Why"
    },
    {
      "order": 2,
      "type": "concept",
      "title": "Concepto visual"
    },
    {
      "order": 3,
      "type": "contract",
      "title": "Contrato de la pieza"
    },
    {
      "order": 4,
      "type": "code",
      "title": "Código incremental"
    },
    {
      "order": 5,
      "type": "simulation",
      "title": "Simulación / laboratorio"
    },
    {
      "order": 6,
      "type": "assembly",
      "title": "Ensamblaje con piezas previas"
    },
    {
      "order": 7,
      "type": "checkpoint",
      "title": "Prueba y checkpoint"
    }
  ],
  "verification": [
    "source syntax",
    "module-specific unit/integration test",
    "manual device check when native APIs are used"
  ],
  "status": "IMPLEMENTED_SOURCE"
}