{
  "id": "hito-14-backup-settings",
  "hito": 14,
  "title": "Backup, restore y administración",
  "kind": "maobits-pos-module",
  "version": "1.0.0",
  "dependencies": [
    "database",
    "products",
    "customers",
    "sales"
  ],
  "concepts": [
    "versioned backup",
    "media",
    "restore",
    "demo",
    "purge"
  ],
  "sourcePaths": [
    "src/core/backup",
    "src/modules/settings",
    "app/backup.tsx",
    "app/settings.tsx"
  ],
  "assembly": {
    "inputContracts": [
      "Session/User when required",
      "Repository/Service contracts from dependencies"
    ],
    "outputContracts": [
      "backup-settings service/API",
      "Persisted state where applicable"
    ],
    "rule": "The module may be taught independently, then assembled only through declared contracts."
  },
  "slides": [
    {
      "order": 1,
      "type": "need",
      "title": "Necesidad / Why"
    },
    {
      "order": 2,
      "type": "concept",
      "title": "Concepto visual"
    },
    {
      "order": 3,
      "type": "contract",
      "title": "Contrato de la pieza"
    },
    {
      "order": 4,
      "type": "code",
      "title": "Código incremental"
    },
    {
      "order": 5,
      "type": "simulation",
      "title": "Simulación / laboratorio"
    },
    {
      "order": 6,
      "type": "assembly",
      "title": "Ensamblaje con piezas previas"
    },
    {
      "order": 7,
      "type": "checkpoint",
      "title": "Prueba y checkpoint"
    }
  ],
  "verification": [
    "source syntax",
    "module-specific unit/integration test",
    "manual device check when native APIs are used"
  ],
  "status": "IMPLEMENTED_SOURCE"
}